{
  "$schema": "../../schemas/plugin.schema.json",
  "schema_version": 1,
  "name": "cern-code",
  "display_name": "CERN Code",
  "description": "Optional read-only discovery of public and user-authorized CERN GitLab projects and source code.",
  "version": "0.1.0",
  "author": {
    "name": "LHCb Agent Marketplace contributors",
    "url": "https://github.com/MohamedElashri"
  },
  "license": "MIT",
  "keywords": [
    "CERN",
    "GitLab",
    "source code",
    "LHCb"
  ],
  "interface": {
    "short_description": "Discover CERN GitLab projects and code.",
    "long_description": "An optional integration boundary for read-only CERN GitLab project, repository, release, and source-code discovery.",
    "category": "Science & Research",
    "default_prompts": [
      "Find the public CERN GitLab project for DaVinci.",
      "Inspect the structure of an LHCb software project."
    ]
  },
  "capabilities": {
    "skills": false,
    "mcp": true
  }
}
