{
  "$schema": "../../schemas/plugin.schema.json",
  "schema_version": 1,
  "name": "root-analysis",
  "display_name": "ROOT Analysis",
  "description": "Optional inspection and analysis of ROOT files within explicitly configured data boundaries.",
  "version": "0.1.0-rc.1",
  "author": {
    "name": "LHCb Agent Marketplace contributors",
    "url": "https://github.com/MohamedElashri"
  },
  "license": "MIT",
  "keywords": [
    "ROOT",
    "HEP",
    "data analysis",
    "histograms",
    "ntuples"
  ],
  "interface": {
    "short_description": "Inspect and analyze bounded ROOT data.",
    "long_description": "An optional integration boundary for inspecting ROOT trees, branches, histograms, statistics, and plots inside explicitly allowed data locations.",
    "category": "Science & Research",
    "default_prompts": [
      "Inspect the trees and branches in this ROOT file.",
      "Summarize the distributions in this ntuple."
    ]
  },
  "capabilities": {
    "skills": false,
    "mcp": true
  }
}
